{
  "schema_version": "1.0.0",
  "record_type": "attempt",
  "attempt_id": "attempt-20260802-001",
  "created_at": "2026-08-02T12:00:00Z",
  "purpose": "Run the declared product gate and retain its evidence.",
  "actor": {
    "kind": "agent",
    "identifier": "replace-with-agent-or-human-id"
  },
  "authority_refs": [
    "replace-with-authority-reference"
  ],
  "governance_identity": {
    "method": "Governance-First Development",
    "version": "0.1-draft+aoi-1.0.0",
    "criteria_id": "replace-with-criteria-id",
    "criteria_sha256": null
  },
  "planned_gates": [
    {
      "gate_id": "preflight",
      "sequence": 1,
      "kind": "preparatory",
      "authority_ref": "replace-with-gate-authority",
      "description": "Verify the declared inputs and environment."
    },
    {
      "gate_id": "product-gate",
      "sequence": 2,
      "kind": "product",
      "authority_ref": "replace-with-gate-authority",
      "description": "Evaluate the product acceptance criterion."
    }
  ],
  "target_product_gate": "product-gate",
  "product_artifact_ref": "replace-with-product-artifact",
  "source_occurrence_id": null,
  "promotion_basis": "declared_attempt",
  "context_refs": [],
  "relations": []
}
