{
  "schema_version": "1.0.0", "record_type": "attempt", "attempt_id": "case-H-attempt", "created_at": "2026-08-02T13:30:00Z",
  "purpose": "Evaluate the product after environment preparation.",
  "actor": {"kind": "automation", "identifier": "synthetic-runner"},
  "authority_refs": ["examples/attempt-lineage/README.md#case-h"],
  "governance_identity": {"method": "GFD", "version": "0.1-draft+AOI-1.0.0", "criteria_id": "case-H-criteria", "criteria_sha256": null},
  "planned_gates": [
    {"gate_id": "case-H-environment", "sequence": 1, "kind": "preparatory", "authority_ref": "case-H-criteria", "description": "Prepare the environment."},
    {"gate_id": "case-H-product", "sequence": 2, "kind": "product", "authority_ref": "case-H-criteria", "description": "Evaluate target behavior."}
  ],
  "target_product_gate": "case-H-product", "source_occurrence_id": null, "promotion_basis": "declared_attempt", "relations": []
}
